{
  "schema_version": 1,
  "destination_id": "S13-CHILD-BARBECUE",
  "service_id": "S13",
  "deployment": {
    "action": "create",
    "current_wp_id": null,
    "current_post_type": null,
    "current_url": null,
    "target_template": "newservicepost.php",
    "preserve_id": false,
    "preserve_permalink": false
  },
  "slug": "naves-dlya-zony-barbekyu",
  "canonical": "https://exp76.ru/naves-dlya-zony-barbekyu/",
  "post_title": "Навес для зоны барбекю",
  "seo": {
    "title": "Навес для зоны барбекю в Ярославле — металлический каркас",
    "description": "Навес над зоной барбекю в Ярославле и области: расположение опор, кровля, водоотвод и безопасная компоновка относительно печного оборудования."
  },
  "h1": "Навес для зоны барбекю",
  "lead": "Проектируем защитную конструкцию над зоной приготовления и отдыха после согласования печного оборудования, проходов, мебели и требований к безопасным расстояниям.",
  "scope": {
    "heading": "Что учитывает навес над барбекю",
    "text": "Металлический навес не является проектом печного комплекса: сначала фиксируются параметры источника огня и требования его изготовителя или проектировщика.",
    "results": [
      {
        "title": "Зонирование",
        "text": "Разводим место приготовления, столовую часть, проходы и опоры в единой планировке."
      },
      {
        "title": "Конструкция покрытия",
        "text": "Определяем высоту, форму каркаса и кровельное решение с учётом тепловой зоны."
      },
      {
        "title": "Отвод осадков",
        "text": "Направляем воду от рабочей площадки, печной части и маршрутов пользователей."
      }
    ]
  },
  "audience": {
    "heading": "Для каких барбекю-зон подходит навес",
    "text": "Решение предназначено для стационарной открытой площадки, где известна будущая или существующая компоновка оборудования.",
    "items": [
      {
        "title": "Печной комплекс",
        "text": "Нужно перекрыть рабочую зону, сохранив требования к дымоходу и воздушным расстояниям."
      },
      {
        "title": "Мангал и стол",
        "text": "Навес объединяет приготовление и посадочные места без опор в проходах."
      },
      {
        "title": "Отдельная площадка",
        "text": "Конструкция должна вписаться в сад и связаться с дорожками и покрытием."
      }
    ]
  },
  "process": {
    "heading": "Как проектируем навес барбекю",
    "steps": [
      {
        "title": "Исходная компоновка",
        "text": "Получаем размеры площадки и данные о печи, дымоходе, мангале и мебели."
      },
      {
        "title": "Проверка ограничений",
        "text": "Отмечаем тепловую зону, проходы, соседние строения и растительность."
      },
      {
        "title": "Эскиз каркаса",
        "text": "Размещаем опоры и кровлю относительно оборудования и видимых сторон участка."
      },
      {
        "title": "Конструктивное решение",
        "text": "Прорабатываем узлы, основания и проход дымохода, если он предусмотрен отдельным проектом."
      },
      {
        "title": "Изготовление и монтаж",
        "text": "Собираем согласованную металлическую конструкцию без вмешательства в печную часть."
      },
      {
        "title": "Финишная проверка",
        "text": "Контролируем геометрию, водоотвод и доступность проходов вокруг рабочей зоны."
      }
    ]
  },
  "pricing": {
    "heading": "Факторы расчёта навеса барбекю",
    "text": "Стоимость зависит от площади, высоты, схемы опор, кровли и сложности сопряжения с уже выбранным печным оборудованием.",
    "factors": [
      {
        "title": "Размер зоны",
        "text": "Учитываем пространство приготовления, посадочные места и защищаемые проходы."
      },
      {
        "title": "Печной узел",
        "text": "Положение и параметры оборудования влияют на форму и отдельные детали кровли."
      },
      {
        "title": "Каркас и опоры",
        "text": "Сечения и основания определяются принятой конструктивной схемой."
      },
      {
        "title": "Окружение",
        "text": "Монтаж рядом с готовым мощением, растениями и строениями требует дополнительной привязки."
      }
    ]
  },
  "proof": {
    "evidence_ref": "S13-CHILD-BARBECUE",
    "case_ids": [],
    "main_image_attachment_id": 9313,
    "main_image_alt": "Металлический навес на профильной странице услуг",
    "caption": "Фото со страницы металлических навесов даёт визуальный контекст каркаса; конкретная зона барбекю и её параметры не подтверждаются."
  },
  "geo": {
    "heading": "Навесы для барбекю в Ярославской области",
    "text": "Работаем с площадками Ярославля, Рыбинска и области; выезд позволяет связать навес с фактическим печным узлом и благоустройством.",
    "areas": [
      "Ярославль",
      "Рыбинск",
      "Ярославская область"
    ]
  },
  "faq": {
    "heading": "Вопросы о навесе барбекю",
    "items": [
      {
        "question": "Можно поставить навес над готовой печью?",
        "answer": "Можно рассматривать такой вариант после получения параметров печи, дымохода и требований к окружающим конструкциям."
      },
      {
        "question": "Вы строите печь вместе с навесом?",
        "answer": "Печные комплексы относятся к соседнему направлению и согласуются как отдельный состав работ."
      },
      {
        "question": "Как вывести дымоход через кровлю?",
        "answer": "Узел определяется проектом печи и материалом кровли; его нельзя назначить без этих данных."
      },
      {
        "question": "Где лучше расположить опоры?",
        "answer": "Опоры размещаем вне проходов и рабочих мест, но итог зависит от пролётов и основания площадки."
      },
      {
        "question": "Что прислать для расчёта?",
        "answer": "Нужны план зоны, фото, размеры оборудования, положение дымохода и желаемая площадь покрытия."
      }
    ]
  },
  "links": {
    "parent": {
      "page_key": "S13-HUB",
      "url": "https://exp76.ru/services/navesy-iz-metalla/",
      "label": "Металлические навесы"
    },
    "related_services": [
      {
        "page_key": "S13-CHILD-CARPORT",
        "url": "https://exp76.ru/naves-dlya-avtomobilya/",
        "label": "Навес для автомобиля"
      },
      {
        "page_key": "S13-CHILD-TERRACE",
        "url": "https://exp76.ru/naves-dlya-terrasy-i-verandy/",
        "label": "Навес для террасы и веранды"
      }
    ]
  },
  "cta": {
    "heading": "Спроектировать навес над барбекю",
    "text": "Отправьте схему площадки и печного оборудования — проверим компоновку и перечень исходных данных.",
    "primary_label": "Получить расчёт",
    "primary_url": "#calc",
    "secondary_label": "Задать вопрос",
    "secondary_url": "#consultation"
  },
  "boundary": {
    "summary": "Включено: изготовление и монтаж навеса над зоной барбекю. Исключённые основные интенты: гараж и парковочная площадка, капитальная пристройка, печной комплекс, неподтверждённые сроки, бренды и гарантии.",
    "excluded_intents": [
      "гараж и парковочная площадка",
      "капитальная пристройка",
      "печной комплекс",
      "неподтверждённые сроки, бренды и гарантии"
    ]
  }
}
