{
  "schema_version": 1,
  "destination_id": "S3-CHILD-LARGE",
  "service_id": "S3",
  "deployment": {
    "action": "create",
    "current_wp_id": null,
    "current_post_type": null,
    "current_url": null,
    "target_template": "newservicepost.php",
    "preserve_id": false,
    "preserve_permalink": false
  },
  "slug": "posadka-krupnomerov",
  "canonical": "https://exp76.ru/posadka-krupnomerov/",
  "post_title": "Посадка крупномеров",
  "seo": {
    "title": "Посадка крупномеров в Ярославле — подбор и посадочные работы",
    "description": "Посадка крупномеров в Ярославле, Рыбинске и области: подготовленная логистика, этапы работ, границы услуги и факторы индивидуального расчёта стоимости."
  },
  "h1": "Посадка крупномеров в Ярославле",
  "lead": "Организуем посадку крупномерных деревьев с подготовкой места, безопасным перемещением корневого кома и фиксацией растения на период начальной стабилизации.",
  "scope": {
    "heading": "Что получает заказчик после посадки",
    "text": "Крупномер требует отдельной логистики и оценки доступов. Размер сам по себе не подтверждает пригодность дерева: до работ проверяются состояние материала и соответствие условиям участка.",
    "results": [
      {
        "title": "Подготовленная логистика",
        "text": "Планируем доставку и путь перемещения дерева без необоснованного риска для покрытий и построек."
      },
      {
        "title": "Посадочное место по комy",
        "text": "Готовим яму под фактические габариты корневой системы и особенности почвы."
      },
      {
        "title": "Установленное и закреплённое дерево",
        "text": "Выверяем положение, выполняем засыпку, полив и согласованную систему опор."
      }
    ]
  },
  "audience": {
    "heading": "Когда подходит эта посадочная услуга",
    "text": "Разбираем задачу именно как «посадка крупномеров» и не переносим на неё обещания соседних услуг направления.",
    "items": [
      {
        "title": "Быстрый пространственный эффект",
        "text": "Подходит, когда проекту нужны заметные древесные объёмы без ожидания роста маленьких саженцев."
      },
      {
        "title": "Акцент возле дома",
        "text": "Используется для одиночного дерева в видовой точке после проверки расстояний до конструкций."
      },
      {
        "title": "Формирование взрослой группы",
        "text": "Позволяет собрать каркас озеленения из нескольких совместимых деревьев крупного размера."
      }
    ]
  },
  "process": {
    "heading": "Как организуем посадку растений",
    "steps": [
      {
        "title": "Осмотр места",
        "text": "Проверяем посадочное место, грунт, подъезд, радиусы работы техники и препятствия над маршрутом."
      },
      {
        "title": "Подбор растений",
        "text": "Согласовываем вид, состояние, размер дерева и параметры корневого кома до доставки."
      },
      {
        "title": "Разметка и подготовка",
        "text": "Размечаем место и готовим яму, материалы для засыпки, полива и последующей фиксации."
      },
      {
        "title": "Посадка",
        "text": "Перемещаем дерево, устанавливаем его по высоте, заполняем яму и проливаем посадочную зону."
      },
      {
        "title": "Первичный уход",
        "text": "Монтируем предусмотренные опоры и передаём режим наблюдения за влажностью и устойчивостью."
      }
    ]
  },
  "pricing": {
    "heading": "Из чего складывается стоимость посадки",
    "text": "Смету на услугу «Посадка крупномеров» готовим после исходных данных и осмотра: считаем только согласованные операции, материалы и условия доступа.",
    "factors": [
      {
        "title": "Габариты дерева",
        "text": "Высота, масса и корневой ком определяют технику, число операций и сложность перемещения."
      },
      {
        "title": "Доступ к месту",
        "text": "Узкие ворота, готовые покрытия и воздушные препятствия ограничивают возможную схему доставки."
      },
      {
        "title": "Посадочная среда",
        "text": "Почва и уровень влажности влияют на подготовку ямы и выбор сопутствующих материалов."
      },
      {
        "title": "Система крепления",
        "text": "Тип и объём фиксации подбираются по размеру дерева и открытости территории."
      }
    ]
  },
  "proof": {
    "evidence_ref": "S3-CHILD-LARGE",
    "case_ids": [],
    "main_image_attachment_id": 9194,
    "main_image_alt": "Озеленённый участок как контекст посадки крупномерных деревьев",
    "caption": "Изображение показывает общее озеленение территории без утверждения размера растений и способа их посадки; кадр используется как визуальный контекст без привязки к адресу или отдельному кейсу."
  },
  "geo": {
    "heading": "Посадка крупномеров: география выезда",
    "text": "Работы по услуге «Посадка крупномеров» выполняем в Ярославле, Рыбинске и населённых пунктах Ярославской области; логистику и возможность выезда оцениваем по адресу и составу задачи.",
    "areas": [
      "Ярославль",
      "Рыбинск",
      "Ярославская область"
    ]
  },
  "faq": {
    "heading": "Вопросы про посадка крупномеров",
    "items": [
      {
        "question": "Какие деревья считаются крупномерными?",
        "answer": "В задаче важнее фактические габариты, масса кома и способ перемещения, а не формальное название категории."
      },
      {
        "question": "Обязательно ли использовать технику?",
        "answer": "Способ выбирается после оценки массы растения и доступа; ручное перемещение допустимо не для каждого материала."
      },
      {
        "question": "Можно посадить дерево на готовом газоне?",
        "answer": "Можно оценить маршрут и защиту покрытия, но воздействие на газон и земляные работы заранее учитываются."
      },
      {
        "question": "Как проверить качество растения?",
        "answer": "До доставки осматривают крону, ствол, корневой ком и общее состояние посадочного материала."
      },
      {
        "question": "Когда снимают крепления?",
        "answer": "Состояние опор контролируют в ходе ухода и снимают по фактической устойчивости дерева, а не по универсальной дате."
      }
    ]
  },
  "links": {
    "parent": {
      "page_key": "S3-HUB",
      "url": "https://exp76.ru/services/posadka-derevev-i-kustarnikov/",
      "label": "Посадка деревьев и кустарников"
    },
    "related_services": [
      {
        "page_key": "S3-CHILD-FRUIT",
        "url": "https://exp76.ru/posadka-plodovyh-derevev/",
        "label": "Посадка плодовых деревьев"
      },
      {
        "page_key": "S3-CHILD-CONIFERS",
        "url": "https://exp76.ru/posadka-hvojnyh-derevev/",
        "label": "Посадка хвойных деревьев"
      },
      {
        "page_key": "S3-CHILD-SHRUBS",
        "url": "https://exp76.ru/posadka-kustarnikov/",
        "label": "Посадка кустарников"
      },
      {
        "page_key": "S3-CHILD-HEDGE",
        "url": "https://exp76.ru/posadka-zhivoj-izgorodi/",
        "label": "Посадка живой изгороди"
      }
    ]
  },
  "cta": {
    "heading": "Рассчитать услугу «Посадка крупномеров»",
    "text": "Пришлите фотографии, адрес и краткое описание задачи по услуге «Посадка крупномеров» — проверим исходные условия и подготовим состав работ для расчёта.",
    "primary_label": "Получить расчёт",
    "primary_url": "#calc",
    "secondary_label": "Обсудить задачу",
    "secondary_url": "#consultation"
  },
  "boundary": {
    "summary": "Крупные формы, доставка и механизация; молодые деревья разведены по видам.",
    "excluded_intents": [
      "аренда техники без посадки",
      "пересадка взрослых деревьев с участка",
      "обещание полной приживаемости"
    ]
  }
}
