{
  "schema_version": 1,
  "destination_id": "S7-CHILD-LANDSCAPE",
  "service_id": "S7",
  "deployment": {
    "action": "create",
    "current_wp_id": null,
    "current_post_type": null,
    "current_url": null,
    "target_template": "newservicepost.php",
    "preserve_id": false,
    "preserve_permalink": false
  },
  "slug": "landshaftnoe-osveshchenie-uchastka",
  "canonical": "https://exp76.ru/landshaftnoe-osveshchenie-uchastka/",
  "post_title": "Ландшафтное и декоративное освещение сада",
  "seo": {
    "title": "Ландшафтное и декоративное освещение сада в Ярославле — проектирование и монтаж",
    "description": "Ландшафтное и декоративное освещение сада в Ярославле, Рыбинске и области: освещённые маршруты, этапы работ, границы услуги и факторы индивидуального расчёта стоимости."
  },
  "h1": "Ландшафтное и декоративное освещение сада в Ярославле",
  "lead": "Создаём ландшафтное освещение сада, выделяя маршруты, растения и малые формы мягкими световыми акцентами без избыточной яркости и случайных бликов.",
  "scope": {
    "heading": "Какой результат даёт отдельное решение",
    "text": "Садовый свет строится вокруг вечерних видов и безопасности движения. Размещение приборов учитывает рост растений, работу садовой техники и возможность обслуживания.",
    "results": [
      {
        "title": "Освещённые маршруты",
        "text": "Помогаем различать края дорожек, ступени и повороты в вечернем сценарии участка."
      },
      {
        "title": "Акценты на растениях",
        "text": "Направляем свет на выбранные кроны и композиции, контролируя видимые источники и соседние зоны."
      },
      {
        "title": "Связная вечерняя картина",
        "text": "Согласуем яркость функционального и декоративного света, чтобы отдельные точки не спорили между собой."
      }
    ]
  },
  "audience": {
    "heading": "Когда нужна эта система освещения",
    "text": "Разбираем задачу именно как «ландшафтное и декоративное освещение сада» и не переносим на неё обещания соседних услуг направления.",
    "items": [
      {
        "title": "Сформированный сад",
        "text": "Подходит для участка, где уже понятны ключевые растения и вечерние маршруты."
      },
      {
        "title": "Новая концепция благоустройства",
        "text": "Позволяет заложить кабельные трассы до газона и финишных посадочных работ."
      },
      {
        "title": "Зона отдыха",
        "text": "Помогает создать мягкий свет вокруг террасы, беседки и прилегающих садовых композиций."
      }
    ]
  },
  "process": {
    "heading": "Как создаём освещение",
    "steps": [
      {
        "title": "Сценарий света",
        "text": "Определяем вечерние маршруты, видовые точки и растения, которые должны участвовать в световом сценарии."
      },
      {
        "title": "Обследование",
        "text": "Осматриваем рельеф, посадки, покрытия и возможные места, где приборы будут доступны для ухода."
      },
      {
        "title": "Подбор решения",
        "text": "Подбираем направления света и типы оборудования, согласуя их с другими группами наружного освещения."
      },
      {
        "title": "Монтажные работы",
        "text": "Монтируем предусмотренные линии и приборы, защищая корни и существующие элементы сада."
      },
      {
        "title": "Настройка и проверка",
        "text": "Проводим вечернюю настройку направлений и проверяем, не создаёт ли свет нежелательных бликов."
      }
    ]
  },
  "pricing": {
    "heading": "Что определяет стоимость освещения",
    "text": "Смету на услугу «Ландшафтное и декоративное освещение сада» готовим после исходных данных и осмотра: считаем только согласованные операции, материалы и условия доступа.",
    "factors": [
      {
        "title": "Количество акцентов",
        "text": "Каждое растение, группа или маршрут требует отдельного подбора положения и направления прибора."
      },
      {
        "title": "Зрелость посадок",
        "text": "Плотный сад усложняет прокладку трасс и требует учитывать сезонные изменения кроны."
      },
      {
        "title": "Рельеф и покрытия",
        "text": "Перепады и готовое благоустройство влияют на монтаж и защиту рабочих зон."
      },
      {
        "title": "Сценарии управления",
        "text": "Разделение маршрутов и декоративных групп увеличивает состав коммутации и настройки."
      }
    ]
  },
  "proof": {
    "evidence_ref": "S7-CHILD-LANDSCAPE",
    "case_ids": [],
    "main_image_attachment_id": 9195,
    "main_image_alt": "Садовое освещение из сервисного фотопула наружного света",
    "caption": "Изображение показывает сервисное изображение наружного освещения без отнесения его к отдельному ландшафтному кейсу; кадр используется как визуальный контекст без привязки к адресу или отдельному кейсу."
  },
  "geo": {
    "heading": "Ландшафтное и декоративное освещение сада: география выезда",
    "text": "Работы по услуге «Ландшафтное и декоративное освещение сада» выполняем в Ярославле, Рыбинске и населённых пунктах Ярославской области; логистику и возможность выезда оцениваем по адресу и составу задачи.",
    "areas": [
      "Ярославль",
      "Рыбинск",
      "Ярославская область"
    ]
  },
  "faq": {
    "heading": "Вопросы про ландшафтное и декоративное освещение сада",
    "items": [
      {
        "question": "Чем ландшафтный свет отличается от уличного?",
        "answer": "Он работает с садовыми композициями и атмосферой, тогда как функциональный свет прежде всего обслуживает маршруты."
      },
      {
        "question": "Не повредит ли монтаж корни?",
        "answer": "Трассы выбираются после осмотра посадок, а сложные зоны обходятся или прорабатываются вручную."
      },
      {
        "question": "Можно подсветить взрослое дерево?",
        "answer": "Да, положение и мощность подбираются по форме кроны, точкам обзора и соседним объектам."
      },
      {
        "question": "Когда лучше настраивать приборы?",
        "answer": "Финальную регулировку полезно выполнять в тёмное время, когда видны реальные границы световых пятен."
      },
      {
        "question": "Нужно ли менять схему по мере роста сада?",
        "answer": "Некоторые направления света со временем корректируются, поскольку кроны и плотность посадок меняются."
      }
    ]
  },
  "links": {
    "parent": {
      "page_key": "S7-HUB",
      "url": "https://exp76.ru/services/ulichnoe-osveshhenie-uchastka/",
      "label": "Уличное освещение участка"
    },
    "related_services": [
      {
        "page_key": "S7-CHILD-DESIGN",
        "url": "https://exp76.ru/proekt-osveshcheniya-uchastka/",
        "label": "Проект освещения участка"
      },
      {
        "page_key": "S7-CHILD-INSTALL",
        "url": "https://exp76.ru/montazh-osveshcheniya-uchastka/",
        "label": "Монтаж уличного освещения участка"
      },
      {
        "page_key": "S7-CHILD-ARCHITECTURAL",
        "url": "https://exp76.ru/arhitekturnaya-podsvetka-doma/",
        "label": "Архитектурная подсветка частного дома"
      },
      {
        "page_key": "S7-CHILD-HOLIDAY",
        "url": "https://exp76.ru/novogodnee-osveshhenie-zagorodnogo-doma-v-rybinske-i-jaroslavskojj-oblasti/",
        "label": "Новогоднее освещение загородного дома"
      }
    ]
  },
  "cta": {
    "heading": "Рассчитать услугу «Ландшафтное и декоративное освещение сада»",
    "text": "Пришлите фотографии, адрес и краткое описание задачи по услуге «Ландшафтное и декоративное освещение сада» — проверим исходные условия и подготовим состав работ для расчёта.",
    "primary_label": "Получить расчёт",
    "primary_url": "#calc",
    "secondary_label": "Обсудить задачу",
    "secondary_url": "#consultation"
  },
  "boundary": {
    "summary": "Сад и композиция; архитектурная подсветка дома разведена.",
    "excluded_intents": [
      "постоянная архитектурная подсветка фасада",
      "новогоднее оформление",
      "освещение внутри дома"
    ]
  }
}
