{
  "schema_version": 1,
  "destination_id": "S7-CHILD-INSTALL",
  "service_id": "S7",
  "deployment": {
    "action": "create",
    "current_wp_id": null,
    "current_post_type": null,
    "current_url": null,
    "target_template": "newservicepost.php",
    "preserve_id": false,
    "preserve_permalink": false
  },
  "slug": "montazh-osveshcheniya-uchastka",
  "canonical": "https://exp76.ru/montazh-osveshcheniya-uchastka/",
  "post_title": "Монтаж уличного освещения участка",
  "seo": {
    "title": "Монтаж уличного освещения участка в Ярославле — проектирование и монтаж",
    "description": "Монтаж уличного освещения участка в Ярославле, Рыбинске и области: смонтированные линии, этапы работ, границы услуги и факторы индивидуального расчёта стоимости."
  },
  "h1": "Монтаж уличного освещения участка в Ярославле",
  "lead": "Монтируем наружное освещение участка по согласованной схеме: прокладываем предусмотренные линии, устанавливаем оборудование и проверяем работу групп управления.",
  "scope": {
    "heading": "Какой результат даёт отдельное решение",
    "text": "Реализация начинается после определения световых задач и состава оборудования. Земляные операции, электромонтаж и восстановление покрытий фиксируются в смете до выхода на объект.",
    "results": [
      {
        "title": "Смонтированные линии",
        "text": "Прокладываем кабельные трассы в согласованных зонах с учётом выбранного способа защиты."
      },
      {
        "title": "Установленные приборы",
        "text": "Размещаем опоры, светильники и элементы управления в предусмотренных проектом точках."
      },
      {
        "title": "Проверенные группы",
        "text": "Тестируем включение, направление света и работу согласованных сценариев после подключения."
      }
    ]
  },
  "audience": {
    "heading": "Когда нужна эта система освещения",
    "text": "Монтаж нужен по готовому или согласованному решению, когда требуется безопасно проложить линии, установить светильники, подключить управление и проверить работу.",
    "items": [
      {
        "title": "Реализация нового проекта",
        "text": "Подходит для монтажа одновременно с благоустройством до устройства финишных покрытий."
      },
      {
        "title": "Замена старой системы",
        "text": "Нужна для обновления наружных приборов и линий после обследования существующей сети."
      },
      {
        "title": "Добавление отдельных зон",
        "text": "Применяется при расширении света на дорожки, въезд или площадку с проверкой доступной мощности."
      }
    ]
  },
  "process": {
    "heading": "Как создаём освещение",
    "steps": [
      {
        "title": "Сценарий света",
        "text": "Сверяем проект, точки установки, группы управления и готовность электропитания к подключению."
      },
      {
        "title": "Обследование",
        "text": "Осматриваем трассы и примыкания, отмечая пересечения с покрытиями, посадками и коммуникациями."
      },
      {
        "title": "Подбор решения",
        "text": "Комплектуем согласованные материалы и подготавливаем основания либо места крепления приборов."
      },
      {
        "title": "Монтажные работы",
        "text": "Прокладываем линии, устанавливаем оборудование и выполняем соединения в предусмотренном исполнении."
      },
      {
        "title": "Настройка и проверка",
        "text": "Проверяем группы, корректируем направление приборов и передаём схему фактически установленного решения."
      }
    ]
  },
  "pricing": {
    "heading": "Что определяет стоимость освещения",
    "text": "Смету на услугу «Монтаж уличного освещения участка» готовим после исходных данных и осмотра: считаем только согласованные операции, материалы и условия доступа.",
    "factors": [
      {
        "title": "Протяжённость трасс",
        "text": "Длина линий и количество пересечений определяют объём земляных и электромонтажных операций."
      },
      {
        "title": "Число приборов",
        "text": "Учитываем точки установки, основания, крепления и подключения каждого элемента."
      },
      {
        "title": "Готовность участка",
        "text": "Работа на сформированном ландшафте требует больше защиты и ручного восстановления зон."
      },
      {
        "title": "Управление",
        "text": "Датчики, отдельные группы и иные согласованные сценарии влияют на состав оборудования и настройки."
      }
    ]
  },
  "proof": {
    "evidence_ref": "S7-CHILD-INSTALL",
    "case_ids": [
      9684,
      8604,
      8620
    ],
    "main_image_attachment_id": 9689,
    "main_image_alt": "Наружное освещение на объектах из опубликованных кейсов",
    "caption": "Опубликованные материалы WP 9684, WP 8604, WP 8620 подтверждают монтаж наружного и архитектурного освещения в опубликованных кейсах; отдельный кадр не приписан неподтверждённому этапу."
  },
  "geo": {
    "heading": "Монтаж уличного освещения участка: география выезда",
    "text": "Работы по услуге «Монтаж уличного освещения участка» выполняем в Ярославле, Рыбинске и населённых пунктах Ярославской области; логистику и возможность выезда оцениваем по адресу и составу задачи.",
    "areas": [
      "Ярославль",
      "Рыбинск",
      "Ярославская область"
    ]
  },
  "faq": {
    "heading": "Частые вопросы о монтаже уличного освещения",
    "items": [
      {
        "question": "Можно монтировать без проекта?",
        "answer": "Для небольшой локальной задачи формируется схема, но состав и трассы всё равно согласуются до работы."
      },
      {
        "question": "Повредятся ли готовые дорожки?",
        "answer": "Маршруты выбираются с учётом покрытий; неизбежные пересечения и восстановление оговариваются заранее."
      },
      {
        "question": "Кто поставляет светильники?",
        "answer": "Оборудование может входить в комплект или приниматься от заказчика после проверки совместимости с решением."
      },
      {
        "question": "Настраивается ли направление света?",
        "answer": "После включения выполняется первичная регулировка приборов в пределах их конструкции и проектного сценария."
      },
      {
        "question": "Ремонт старой сети входит в монтаж?",
        "answer": "Неисправности существующих линий диагностируются и рассчитываются отдельно от установки новой системы."
      }
    ]
  },
  "links": {
    "parent": {
      "page_key": "S7-HUB",
      "url": "https://exp76.ru/services/ulichnoe-osveshhenie-uchastka/",
      "label": "Уличное освещение участка"
    },
    "related_services": [
      {
        "page_key": "S7-CHILD-DESIGN",
        "url": "https://exp76.ru/proekt-osveshcheniya-uchastka/",
        "label": "Проект освещения участка"
      },
      {
        "page_key": "S7-CHILD-LANDSCAPE",
        "url": "https://exp76.ru/landshaftnoe-osveshchenie-uchastka/",
        "label": "Ландшафтное и декоративное освещение сада"
      },
      {
        "page_key": "S7-CHILD-ARCHITECTURAL",
        "url": "https://exp76.ru/arhitekturnaya-podsvetka-doma/",
        "label": "Архитектурная подсветка частного дома"
      },
      {
        "page_key": "S7-CHILD-HOLIDAY",
        "url": "https://exp76.ru/novogodnee-osveshhenie-zagorodnogo-doma-v-rybinske-i-jaroslavskojj-oblasti/",
        "label": "Новогоднее освещение загородного дома"
      }
    ]
  },
  "cta": {
    "heading": "Рассчитать услугу «Монтаж уличного освещения участка»",
    "text": "Пришлите фотографии, адрес и краткое описание задачи по услуге «Монтаж уличного освещения участка» — проверим исходные условия и подготовим состав работ для расчёта.",
    "primary_label": "Получить расчёт",
    "primary_url": "#calc",
    "secondary_label": "Обсудить задачу",
    "secondary_url": "#consultation"
  },
  "boundary": {
    "summary": "Комплексный монтаж; отдельные сценарии света разведены.",
    "excluded_intents": [
      "монтаж без согласованной схемы",
      "ремонт внутренней электрики дома",
      "поставка оборудования без согласованной спецификации"
    ]
  }
}
