{
  "schema_version": 1,
  "destination_id": "S9-CHILD-TREE-REMOVAL",
  "service_id": "S9",
  "deployment": {
    "action": "create",
    "current_wp_id": null,
    "current_post_type": null,
    "current_url": null,
    "target_template": "newservicepost.php",
    "preserve_id": false,
    "preserve_permalink": false
  },
  "slug": "spil-i-udalenie-derevev",
  "canonical": "https://exp76.ru/spil-i-udalenie-derevev/",
  "post_title": "Спил и удаление деревьев",
  "seo": {
    "title": "Спил и удаление деревьев в Ярославле — расчёт работ",
    "description": "Спил и удаление деревьев в Ярославле и области: оценка дерева и окружения, выбор безопасной последовательности, расчёт состава работ по участку."
  },
  "h1": "Спил и удаление деревьев в Ярославле",
  "lead": "Удаляем отдельные деревья на частных и коммерческих территориях после оценки ствола, кроны, доступа и расположенных рядом объектов.",
  "scope": {
    "heading": "Что входит в удаление дерева",
    "text": "Способ работы выбираем по состоянию дерева и свободному пространству вокруг него; до расчёта фиксируем, что требуется сделать со стволом и ветвями.",
    "results": [
      {
        "title": "Оценка условий",
        "text": "Осматриваем дерево, направление наклона, соседние посадки, строения и доступ к рабочей зоне."
      },
      {
        "title": "Последовательный спил",
        "text": "Определяем порядок снятия ветвей и частей ствола с учётом конкретной обстановки на участке."
      },
      {
        "title": "Согласованный результат",
        "text": "Заранее определяем требуемое состояние площадки после удаления дерева без скрытого расширения задачи."
      }
    ]
  },
  "audience": {
    "heading": "Когда требуется удалить дерево",
    "text": "Услуга относится к удалению дерева целиком, а не к формирующей или санитарной обрезке кроны.",
    "items": [
      {
        "title": "Дерево мешает работам",
        "text": "Ствол находится в зоне будущего строительства, проезда или переустройства участка."
      },
      {
        "title": "Мало свободного места",
        "text": "Рядом расположены забор, дом, линии участка или сохраняемые растения, поэтому нужен поэтапный подход."
      },
      {
        "title": "Нужно освободить зону",
        "text": "Владелец хочет убрать выбранные деревья и заранее понять состав сопутствующих операций."
      }
    ]
  },
  "process": {
    "heading": "Как организуем спил",
    "steps": [
      {
        "title": "Заявка и фотографии",
        "text": "Получаем адрес, фотографии дерева и описание того, что расположено рядом с ним."
      },
      {
        "title": "Осмотр",
        "text": "Проверяем состояние ствола, размеры кроны, уклон территории и возможность доступа."
      },
      {
        "title": "Схема работ",
        "text": "Выбираем последовательность удаления частей дерева и границы рабочей зоны."
      },
      {
        "title": "Подготовка территории",
        "text": "Согласуем сохранение соседних объектов и освобождаем необходимое пространство вокруг дерева."
      },
      {
        "title": "Удаление",
        "text": "Выполняем согласованный спил целиком либо частями согласно условиям площадки."
      },
      {
        "title": "Приёмка",
        "text": "Сверяем результат с заявленным объёмом и отдельно обсуждаем пни или дальнейшую расчистку, если они нужны."
      }
    ]
  },
  "pricing": {
    "heading": "От чего зависит расчёт спила",
    "text": "Стоимость определяем по осмотру или достаточным исходным данным, потому что одинаковые по высоте деревья могут находиться в разных условиях.",
    "factors": [
      {
        "title": "Размер и состояние",
        "text": "Учитываем параметры ствола, строение кроны, наклон и видимые дефекты дерева."
      },
      {
        "title": "Окружение",
        "text": "Оцениваем расстояния до дома, забора, дорожек, коммуникаций и сохраняемых посадок."
      },
      {
        "title": "Доступ",
        "text": "Проверяем подъезд, ширину проходов и возможность безопасно организовать рабочую зону."
      },
      {
        "title": "Итоговый объём",
        "text": "Фиксируем, входит ли только спил или дополнительно требуется разделка древесины на согласованные части."
      }
    ]
  },
  "proof": {
    "evidence_ref": "S9-CHILD-TREE-REMOVAL",
    "case_ids": [],
    "main_image_attachment_id": 7035,
    "main_image_alt": "Дерево на странице услуги по расчистке участка",
    "caption": "Фото со страницы услуги по расчистке показывает профиль работ с древесной растительностью; конкретный объект и способ спила по снимку не заявляются."
  },
  "geo": {
    "heading": "Удаление деревьев по Ярославской области",
    "text": "Принимаем заявки в Ярославле, Рыбинске и других населённых пунктах области; возможность выезда и способ работы определяем после проверки адреса и условий участка.",
    "areas": [
      "Ярославль",
      "Рыбинск",
      "Ярославская область"
    ]
  },
  "faq": {
    "heading": "Вопросы о спиле деревьев",
    "items": [
      {
        "question": "Можно оценить работу по фотографии?",
        "answer": "Фотографии помогают предварительно понять задачу, но при сложном окружении для точного состава работ требуется осмотр."
      },
      {
        "question": "Вы спиливаете дерево целиком или частями?",
        "answer": "Возможный способ зависит от свободного пространства, состояния дерева и расположения объектов рядом."
      },
      {
        "question": "Корчевание пня входит в эту услугу?",
        "answer": "Нет, пень относится к отдельной услуге и включается в расчёт только после явного согласования."
      },
      {
        "question": "Можно сохранить растения рядом?",
        "answer": "Сохраняемые посадки отмечаем до начала работ и учитываем при выборе рабочей последовательности."
      },
      {
        "question": "Что прислать для первого расчёта?",
        "answer": "Нужны общий вид дерева, основание ствола, окружение с нескольких сторон, адрес и желаемый результат."
      }
    ]
  },
  "links": {
    "parent": {
      "page_key": "S9-HUB",
      "url": "https://exp76.ru/services/vykorchevyvanie-pnejj-spil-derevev/",
      "label": "Удаление деревьев и пней"
    },
    "related_services": [
      {
        "page_key": "S9-CHILD-STUMPS",
        "url": "https://exp76.ru/korchevanie-pnej/",
        "label": "Корчевание пней"
      },
      {
        "page_key": "S9-CHILD-CLEARING",
        "url": "https://exp76.ru/raschistka-uchastka-ot-derevev-i-kustarnikov/",
        "label": "Расчистка участка от деревьев и кустарников"
      }
    ]
  },
  "cta": {
    "heading": "Оценить удаление дерева",
    "text": "Пришлите фотографии дерева и участка с нескольких ракурсов — определим, достаточно ли данных для расчёта или нужен осмотр.",
    "primary_label": "Получить расчёт",
    "primary_url": "#calc",
    "secondary_label": "Задать вопрос",
    "secondary_url": "#consultation"
  },
  "boundary": {
    "summary": "Включено: спил и удаление дерева целиком или по частям. Исключённые основные интенты: обрезка деревьев, обрезка кустарников, выравнивание и планировка участка, неподтверждённые вывоз и утилизация, аренда спецтехники без работ.",
    "excluded_intents": [
      "обрезка деревьев",
      "обрезка кустарников",
      "выравнивание и планировка участка",
      "неподтверждённые вывоз и утилизация",
      "аренда спецтехники без работ"
    ]
  }
}
