{
  "schema_version": 1,
  "destination_id": "S4-CHILD-TREE-PRUNING",
  "service_id": "S4",
  "deployment": {
    "action": "create",
    "current_wp_id": null,
    "current_post_type": null,
    "current_url": null,
    "target_template": "newservicepost.php",
    "preserve_id": false,
    "preserve_permalink": false
  },
  "slug": "obrezka-derevev",
  "canonical": "https://exp76.ru/obrezka-derevev/",
  "post_title": "Обрезка деревьев",
  "seo": {
    "title": "Обрезка деревьев в Ярославле — профессиональный уход",
    "description": "Обрезка деревьев в Ярославле, Рыбинске и области: понятная задача по кроне, этапы работ, границы услуги и факторы индивидуального расчёта стоимости."
  },
  "h1": "Обрезка деревьев в Ярославле",
  "lead": "Проводим обрезку деревьев после осмотра кроны и постановки задачи: удаляем мешающие и повреждённые ветви, корректируем форму в допустимом для растения объёме.",
  "scope": {
    "heading": "Какие задачи решает услуга",
    "text": "Способ обрезки зависит от вида, возраста, состояния и сезона. До начала работ определяем цель и доступ к кроне, чтобы не смешивать уход с удалением дерева или его спилом.",
    "results": [
      {
        "title": "Понятная задача по кроне",
        "text": "До резов определяем, какие ветви создают проблему и какой результат допустим для конкретного дерева."
      },
      {
        "title": "Аккуратная обрезка",
        "text": "Удаляем согласованные ветви с учётом их положения, размера и возможности безопасно опустить части кроны."
      },
      {
        "title": "Убранная рабочая зона",
        "text": "Собираем образовавшиеся ветви в предусмотренной границе; дальнейший вывоз включается только по смете."
      }
    ]
  },
  "audience": {
    "heading": "В каких случаях нужен профильный уход",
    "text": "Разбираем задачу именно как «обрезка деревьев» и не переносим на неё обещания соседних услуг направления.",
    "items": [
      {
        "title": "Повреждённые ветви",
        "text": "Услуга нужна, если в кроне есть сухие, сломанные или трущиеся части, требующие оценки."
      },
      {
        "title": "Конфликт с постройками",
        "text": "Помогает скорректировать ветви возле крыши, дорожек и других объектов без автоматического удаления дерева."
      },
      {
        "title": "Формирование молодой кроны",
        "text": "Применяется для последовательной работы с архитектурой дерева при подходящем состоянии и сезоне."
      }
    ]
  },
  "process": {
    "heading": "Как проходит обслуживание",
    "steps": [
      {
        "title": "Диагностика",
        "text": "Осматриваем дерево с земли, оцениваем состояние, окружающие объекты и возможный доступ к кроне."
      },
      {
        "title": "План работ",
        "text": "Фиксируем тип обрезки, перечень основных ветвей и границу сопутствующей уборки."
      },
      {
        "title": "Подготовка",
        "text": "Организуем рабочую зону и выбираем способ доступа, не обещая один метод для всех деревьев."
      },
      {
        "title": "Профильная обработка",
        "text": "Выполняем согласованные резы поэтапно и контролируем опускание отделённых частей кроны."
      },
      {
        "title": "Контроль результата",
        "text": "Осматриваем результат, собираем ветви и сообщаем, когда дереву может потребоваться повторный уход."
      }
    ]
  },
  "pricing": {
    "heading": "Что учитывается при расчёте",
    "text": "Смету на услугу «Обрезка деревьев» готовим после исходных данных и осмотра: считаем только согласованные операции, материалы и условия доступа.",
    "factors": [
      {
        "title": "Высота и объём кроны",
        "text": "Они определяют способ доступа, число резов и организацию безопасной зоны."
      },
      {
        "title": "Состояние ветвей",
        "text": "Сухие, зависшие и повреждённые части требуют разной последовательности работы."
      },
      {
        "title": "Окружение дерева",
        "text": "Провода, постройки, заборы и посадки ограничивают место для опускания ветвей."
      },
      {
        "title": "Обращение с остатками",
        "text": "Измельчение, перенос и вывоз считаются отдельно при включении в заявку."
      }
    ]
  },
  "proof": {
    "evidence_ref": "S4-CHILD-TREE-PRUNING",
    "case_ids": [],
    "main_image_attachment_id": 7501,
    "main_image_alt": "Работы с деревом как контекст профессиональной обрезки кроны",
    "caption": "Изображение показывает работы по деревьям как визуальный контекст без заявления о конкретном виде обрезки; кадр используется как визуальный контекст без привязки к адресу или отдельному кейсу."
  },
  "geo": {
    "heading": "Обрезка деревьев: география выезда",
    "text": "Работы по услуге «Обрезка деревьев» выполняем в Ярославле, Рыбинске и населённых пунктах Ярославской области; логистику и возможность выезда оцениваем по адресу и составу задачи.",
    "areas": [
      "Ярославль",
      "Рыбинск",
      "Ярославская область"
    ]
  },
  "faq": {
    "heading": "Вопросы про обрезка деревьев",
    "items": [
      {
        "question": "Как определить нужный тип обрезки?",
        "answer": "Цель формулируется после осмотра: санитарная работа, корректировка отдельных ветвей или формирование кроны."
      },
      {
        "question": "Можно сильно уменьшить взрослое дерево?",
        "answer": "Допустимый объём зависит от состояния и биологии растения; чрезмерное вмешательство может ему навредить."
      },
      {
        "question": "Нужна ли автовышка?",
        "answer": "Способ доступа выбирается по высоте, окружению и возможности безопасно разместить оборудование."
      },
      {
        "question": "Входит ли вывоз веток?",
        "answer": "Сбор в рабочей зоне описывается в составе работ, а транспортирование согласуется отдельной строкой."
      },
      {
        "question": "Чем обрезка отличается от спила?",
        "answer": "Обрезка сохраняет дерево и работает с кроной, тогда как удаление дерева относится к другому направлению."
      }
    ]
  },
  "links": {
    "parent": {
      "page_key": "S4-HUB",
      "url": "https://exp76.ru/services/ukhod-za-sadom/",
      "label": "Уход за садом"
    },
    "related_services": [
      {
        "page_key": "S4-CHILD-SHRUB-PRUNING",
        "url": "https://exp76.ru/obrezka-kustarnikov-i-zhivoj-izgorodi/",
        "label": "Обрезка кустарников и живой изгороди"
      },
      {
        "page_key": "S4-CHILD-LAWN-CARE",
        "url": "https://exp76.ru/uhod-za-gazonom/",
        "label": "Уход и обслуживание газона"
      },
      {
        "page_key": "S4-CHILD-FLOWERBEDS",
        "url": "https://exp76.ru/uhod-za-cvetnikami-i-klumbami/",
        "label": "Уход за цветниками и клумбами"
      },
      {
        "page_key": "S4-CHILD-PEST",
        "url": "https://exp76.ru/obrabotka-sada-ot-boleznej-i-vreditelej/",
        "label": "Обработка сада от болезней и вредителей"
      }
    ]
  },
  "cta": {
    "heading": "Рассчитать услугу «Обрезка деревьев»",
    "text": "Пришлите фотографии, адрес и краткое описание задачи по услуге «Обрезка деревьев» — проверим исходные условия и подготовим состав работ для расчёта.",
    "primary_label": "Получить расчёт",
    "primary_url": "#calc",
    "secondary_label": "Обсудить задачу",
    "secondary_url": "#consultation"
  },
  "boundary": {
    "summary": "Только деревья; кустарники и живая изгородь разведены.",
    "excluded_intents": [
      "спил и удаление дерева",
      "корчевание пня",
      "необоснованное удаление всей кроны"
    ]
  }
}
